{
  "version": 1,
  "name": "Goan coastal meals without shellfish",
  "day_types": [
    {
      "id": "weekday",
      "name": "Weekday",
      "kcal": 2350,
      "protein_g": 125,
      "carbs_g": 285,
      "fat_g": 78,
      "sat_fat_g_max": 25,
      "fibre_g_min": 29,
      "extra": []
    },
    {
      "id": "weekend",
      "name": "Weekend",
      "kcal": 2500,
      "protein_g": 125,
      "carbs_g": 310,
      "fat_g": 85,
      "sat_fat_g_max": 27,
      "fibre_g_min": 29,
      "extra": []
    }
  ],
  "week": {
    "mon": "weekday",
    "tue": "weekday",
    "wed": "weekday",
    "thu": "weekday",
    "fri": "weekday",
    "sat": "weekend",
    "sun": "weekend"
  },
  "slots": [
    {
      "id": "breakfast",
      "name": "Breakfast",
      "eat_at": "08:00",
      "kcal_share": 0.2,
      "protein_share": 0.2,
      "style": "quick breakfast",
      "cook_when": "fresh",
      "max_active_min": 15,
      "max_total_min": 20
    },
    {
      "id": "lunch",
      "name": "Lunch",
      "eat_at": "13:00",
      "kcal_share": 0.35,
      "protein_share": 0.35,
      "style": "fish curry and rice",
      "cook_when": "fresh",
      "max_active_min": 40,
      "max_total_min": 60
    },
    {
      "id": "snack",
      "name": "Snack",
      "eat_at": "17:00",
      "kcal_share": 0.1,
      "protein_share": 0.1,
      "style": "fruit snack",
      "cook_when": "fresh",
      "max_active_min": 5,
      "max_total_min": 5
    },
    {
      "id": "dinner",
      "name": "Dinner",
      "eat_at": "20:30",
      "kcal_share": 0.35,
      "protein_share": 0.35,
      "style": "pan-fried fish with vegetables",
      "cook_when": "fresh",
      "max_active_min": 35,
      "max_total_min": 45
    }
  ],
  "gear": [
    "kadhai",
    "pressure_cooker",
    "stovetop_pan",
    "blender"
  ],
  "food": {
    "diet": "non_veg",
    "exclude_allergens": [
      "crustaceans"
    ],
    "exclude_foods": [],
    "liked_foods": [
      "surmai",
      "coconut_milk",
      "white_rice",
      "tamarind"
    ],
    "cuisines": [
      "Goan",
      "Konkani"
    ]
  },
  "shopping_days": [
    "wed",
    "sat"
  ]
}
