{
  "version": 1,
  "name": "Maharashtrian home food for busy and lighter days",
  "day_types": [
    {
      "id": "busy",
      "name": "Busy day",
      "kcal": 2300,
      "protein_g": 108,
      "carbs_g": 310,
      "fat_g": 70,
      "sat_fat_g_max": 23,
      "fibre_g_min": 33,
      "extra": []
    },
    {
      "id": "light",
      "name": "Lighter day",
      "kcal": 2150,
      "protein_g": 104,
      "carbs_g": 280,
      "fat_g": 68,
      "sat_fat_g_max": 22,
      "fibre_g_min": 31,
      "extra": []
    }
  ],
  "week": {
    "mon": "busy",
    "tue": "busy",
    "wed": "busy",
    "thu": "light",
    "fri": "light",
    "sat": "light",
    "sun": "busy"
  },
  "slots": [
    {
      "id": "breakfast",
      "name": "Breakfast",
      "eat_at": "08:30",
      "kcal_share": 0.25,
      "protein_share": 0.25,
      "style": "upma or egg breakfast",
      "cook_when": "fresh",
      "max_active_min": 15,
      "max_total_min": 20
    },
    {
      "id": "lunch",
      "name": "Lunch",
      "eat_at": "13:30",
      "kcal_share": 0.3,
      "protein_share": 0.3,
      "style": "roti with matki usal",
      "cook_when": "evening_before",
      "max_active_min": 40,
      "max_total_min": 70
    },
    {
      "id": "snack",
      "name": "Snack",
      "eat_at": "17:30",
      "kcal_share": 0.15,
      "protein_share": 0.15,
      "style": "quick egg snack",
      "cook_when": "fresh",
      "max_active_min": 10,
      "max_total_min": 15
    },
    {
      "id": "dinner",
      "name": "Dinner",
      "eat_at": "21:00",
      "kcal_share": 0.3,
      "protein_share": 0.3,
      "style": "varan bhaat style dinner",
      "cook_when": "fresh",
      "max_active_min": 25,
      "max_total_min": 40
    }
  ],
  "gear": [
    "pressure_cooker",
    "stovetop_pan",
    "microwave",
    "kadhai"
  ],
  "food": {
    "diet": "egg",
    "exclude_allergens": [
      "sesame"
    ],
    "exclude_foods": [],
    "liked_foods": [
      "egg",
      "moth_beans",
      "besan"
    ],
    "cuisines": [
      "Maharashtrian"
    ]
  },
  "shopping_days": [
    "sun",
    "thu"
  ]
}
